{
  "$schema": "./SILT_v0.2_Minimal_Semantic_Conformance_Schema.json",
  "suite_id": "SILT-v0.2-Minimal-Semantic-Conformance-Suite",
  "version": "0.2-release-candidate-2",
  "status": "release-candidate",
  "architecture_seam": [
    "Source",
    "Standing",
    "Presentation",
    "evaluation_at_the_encounter"
  ],
  "allowed_evaluation_outcomes": [
    "SATISFIED",
    "NOT_SATISFIED",
    "INDETERMINATE"
  ],
  "suite_rules": [
    "Only SATISFIED, NOT_SATISFIED and INDETERMINATE are SILT evaluation outcomes.",
    "A condition outside evaluation is recorded in not_evaluated_conditions and MUST NOT be encoded as a fourth outcome.",
    "Each evaluation is identified with the Profile Expression under which it is produced.",
    "No aggregate encounter result is inferred without an expressed composition rule.",
    "Deliberate non-expression remains outside evaluation and MUST NOT be treated as absence or failure.",
    "Negative tests distinguish expected implementation conformance from whether the architecture successfully detects the prohibited behaviour."
  ],
  "worked_encounters": [
    {
      "id": "WE01",
      "title": "Electronic transferable instrument",
      "base_fixture": {
        "case_id": "SILT-v0.2-WE01-ETI-base",
        "title": "Electronic transferable instrument — disputed transfer, valid agent delegation",
        "domain": "electronic_transferable_instrument",
        "profile_expressions": [
          {
            "id": "PE-ETI-PAYMENT-01",
            "aggregate_rule_expressed": false
          }
        ],
        "expected_evaluations": [
          {"profile_expression_id":"PE-ETI-PAYMENT-01","condition_id":"record_integrity","outcome":"SATISFIED"},
          {"profile_expression_id":"PE-ETI-PAYMENT-01","condition_id":"record_control","outcome":"SATISFIED"},
          {"profile_expression_id":"PE-ETI-PAYMENT-01","condition_id":"transfer_provenance","outcome":"INDETERMINATE"},
          {"profile_expression_id":"PE-ETI-PAYMENT-01","condition_id":"standing_entitlement","outcome":"INDETERMINATE"},
          {"profile_expression_id":"PE-ETI-PAYMENT-01","condition_id":"agent_authority","outcome":"SATISFIED"},
          {"profile_expression_id":"PE-ETI-PAYMENT-01","condition_id":"obligation_state","outcome":"SATISFIED"}
        ],
        "not_evaluated_conditions": [
          {"profile_expression_id":"PE-ETI-PAYMENT-01","condition_id":"aggregate_result","reason_code":"no_composition_rule","note":"No aggregate outcome is inferred without an expressed composition rule."}
        ],
        "prohibited_inferences": [
          "record_control => standing_entitlement",
          "agent_technical_capability => agent_authority",
          "cryptographic_validity => universal_legal_validity",
          "standing_indeterminate => obligation_extinguished",
          "condition_results => aggregate_result_without_expressed_rule"
        ],
        "architecture_test_result": "PASS"
      },
      "variants": [
        {"id":"V1","title":"Wrongful controller","facts":"H3 proves technical control, but evidence establishes that the authoritative record was wrongfully obtained.","expected_evaluations":[{"profile_expression_id":"PE-ETI-PAYMENT-01","condition_id":"record_integrity","outcome":"SATISFIED"},{"profile_expression_id":"PE-ETI-PAYMENT-01","condition_id":"record_control","outcome":"SATISFIED"},{"profile_expression_id":"PE-ETI-PAYMENT-01","condition_id":"transfer_provenance","outcome":"NOT_SATISFIED"},{"profile_expression_id":"PE-ETI-PAYMENT-01","condition_id":"standing_entitlement","outcome":"NOT_SATISFIED"},{"profile_expression_id":"PE-ETI-PAYMENT-01","condition_id":"agent_authority","outcome":"SATISFIED"},{"profile_expression_id":"PE-ETI-PAYMENT-01","condition_id":"obligation_state","outcome":"SATISFIED"}],"not_evaluated_conditions":[{"profile_expression_id":"PE-ETI-PAYMENT-01","condition_id":"aggregate_result","reason_code":"no_composition_rule"}],"prohibited_inferences":[],"expected_implementation_conformance":"CONFORMING","architecture_test_result":"PASS","architectural_finding":"Existing Technical Capability/Evidence versus Standing distinction is sufficient; no Holder or Control primitive is required."},
        {"id":"V2","title":"Entitled to enforce without ownership","facts":"The governing instrument law recognises the Participant as entitled to enforce, while the economic ownership position belongs elsewhere.","expected_evaluations":[{"profile_expression_id":"PE-ETI-PAYMENT-01","condition_id":"record_integrity","outcome":"SATISFIED"},{"profile_expression_id":"PE-ETI-PAYMENT-01","condition_id":"record_control","outcome":"SATISFIED"},{"profile_expression_id":"PE-ETI-PAYMENT-01","condition_id":"standing_entitlement_to_enforce","outcome":"SATISFIED"},{"profile_expression_id":"PE-ETI-PAYMENT-01","condition_id":"standing_economic_owner","outcome":"NOT_SATISFIED"},{"profile_expression_id":"PE-ETI-PAYMENT-01","condition_id":"agent_authority","outcome":"SATISFIED"},{"profile_expression_id":"PE-ETI-PAYMENT-01","condition_id":"obligation_state","outcome":"SATISFIED"}],"not_evaluated_conditions":[{"profile_expression_id":"PE-ETI-PAYMENT-01","condition_id":"aggregate_result","reason_code":"no_composition_rule"}],"prohibited_inferences":[],"expected_implementation_conformance":"CONFORMING","architecture_test_result":"PASS","architectural_finding":"Core already permits multiple relational positions and multiple semantic claims in one Presentation."},
        {"id":"V3","title":"Custodial control","facts":"A custodian C has technical control of the authoritative record for H3 under a valid custodial mandate.","expected_evaluations":[{"profile_expression_id":"PE-ETI-PAYMENT-01","condition_id":"record_integrity","outcome":"SATISFIED"},{"profile_expression_id":"PE-ETI-PAYMENT-01","condition_id":"custodian_record_control","outcome":"SATISFIED"},{"profile_expression_id":"PE-ETI-PAYMENT-01","condition_id":"h3_standing_entitlement","outcome":"SATISFIED"},{"profile_expression_id":"PE-ETI-PAYMENT-01","condition_id":"custodian_authority","outcome":"SATISFIED"},{"profile_expression_id":"PE-ETI-PAYMENT-01","condition_id":"obligation_state","outcome":"SATISFIED"}],"not_evaluated_conditions":[{"profile_expression_id":"PE-ETI-PAYMENT-01","condition_id":"aggregate_result","reason_code":"no_composition_rule"}],"prohibited_inferences":[],"expected_implementation_conformance":"CONFORMING","architecture_test_result":"PASS","architectural_finding":"Participant + Authority + Technical Capability + Attribution are sufficient to preserve the distinction."},
        {"id":"V4","title":"Revoked agent","facts":"H3 retains the relevant instrument Standing, but Agent A's delegation was revoked before Presentation.","expected_evaluations":[{"profile_expression_id":"PE-ETI-PAYMENT-01","condition_id":"record_integrity","outcome":"SATISFIED"},{"profile_expression_id":"PE-ETI-PAYMENT-01","condition_id":"record_control","outcome":"SATISFIED"},{"profile_expression_id":"PE-ETI-PAYMENT-01","condition_id":"transfer_provenance","outcome":"SATISFIED"},{"profile_expression_id":"PE-ETI-PAYMENT-01","condition_id":"standing_entitlement","outcome":"SATISFIED"},{"profile_expression_id":"PE-ETI-PAYMENT-01","condition_id":"agent_authority","outcome":"NOT_SATISFIED"},{"profile_expression_id":"PE-ETI-PAYMENT-01","condition_id":"obligation_state","outcome":"SATISFIED"}],"not_evaluated_conditions":[{"profile_expression_id":"PE-ETI-PAYMENT-01","condition_id":"aggregate_result","reason_code":"no_composition_rule"}],"prohibited_inferences":[],"expected_implementation_conformance":"CONFORMING","architecture_test_result":"PASS","architectural_finding":"Existing Authority/Revocation semantics are sufficient; failed agent Authority does not extinguish H3 Standing."},
        {"id":"V5","title":"Incomplete transfer lineage","facts":"Record integrity and control are strong, but one transfer event is missing or disputed.","expected_evaluations":[{"profile_expression_id":"PE-ETI-PAYMENT-01","condition_id":"record_integrity","outcome":"SATISFIED"},{"profile_expression_id":"PE-ETI-PAYMENT-01","condition_id":"record_control","outcome":"SATISFIED"},{"profile_expression_id":"PE-ETI-PAYMENT-01","condition_id":"transfer_provenance","outcome":"INDETERMINATE"},{"profile_expression_id":"PE-ETI-PAYMENT-01","condition_id":"standing_entitlement","outcome":"INDETERMINATE"},{"profile_expression_id":"PE-ETI-PAYMENT-01","condition_id":"agent_authority","outcome":"SATISFIED"},{"profile_expression_id":"PE-ETI-PAYMENT-01","condition_id":"obligation_state","outcome":"SATISFIED"}],"not_evaluated_conditions":[{"profile_expression_id":"PE-ETI-PAYMENT-01","condition_id":"aggregate_result","reason_code":"no_composition_rule"}],"prohibited_inferences":[],"expected_implementation_conformance":"CONFORMING","architecture_test_result":"PASS","architectural_finding":"The base fixture already exercises the intended INDETERMINATE behaviour."},